{
  "protocol_version": "shopping.negotiation/0.1",
  "conversation_id": "conv-001",
  "in_reply_to_message_id": 42,
  "action": "escalate",
  "open_issues": ["buyer requests refund terms not covered by public policy"],
  "public_message": "这个售后条件超出我能确认的范围，我请人工同事来跟进。",
  "reason_codes": ["exceptional_warranty"],
  "request_human_review": true
}
